Unique Retailer SKU;Manufacturer Name;Manufacturer Part Number;Product Title;Categorization;Product URL;Image URL;Detailed Description;Selling Price;Condition;Availability
4;;;$100 Physical Gift Card;Gift Cards;http://www.local.albionextrusions.co.uk/p/4/100-physical-gift-card;http://www.local.albionextrusions.co.uk/content/images/thumbs/0000022_100-physical-gift-card_125.jpeg;Gift Cards must be redeemed through our site Web site toward the purchase of eligible products. Purchases are deducted from the GiftCard balance. Any unused balance will be placed in the recipient's GiftCard account when redeemed. If an order exceeds the amount of the GiftCard, the balance must be paid with a credit card or other available payment method.;100.0000;New;Yes
2;;;$25 Virtual Gift Card;Gift Cards;http://www.local.albionextrusions.co.uk/p/2/25-virtual-gift-card;http://www.local.albionextrusions.co.uk/content/images/thumbs/0000020_25-virtual-gift-card_125.jpeg;Gift Cards must be redeemed through our site Web site toward the purchase of eligible products. Purchases are deducted from the GiftCard balance. Any unused balance will be placed in the recipient's GiftCard account when redeemed. If an order exceeds the amount of the GiftCard, the balance must be paid with a credit card or other available payment method.;25.0000;New;Yes
1;;;$5 Virtual Gift Card;Gift Cards;http://www.local.albionextrusions.co.uk/p/1/5-virtual-gift-card;http://www.local.albionextrusions.co.uk/content/images/thumbs/0000019_5-virtual-gift-card_125.jpeg;Gift Cards must be redeemed through our site Web site toward the purchase of eligible products. Purchases are deducted from the GiftCard balance. Any unused balance will be placed in the recipient's GiftCard account when redeemed. If an order exceeds the amount of the GiftCard, the balance must be paid with a credit card or other available payment method.;5.0000;New;Yes
3;;;$50 Physical Gift Card;Gift Cards;http://www.local.albionextrusions.co.uk/p/3/50-physical-gift-card;http://www.local.albionextrusions.co.uk/content/images/thumbs/0000021_50-physical-gift-card_125.jpeg;Gift Cards must be redeemed through our site Web site toward the purchase of eligible products. Purchases are deducted from the GiftCard balance. Any unused balance will be placed in the recipient's GiftCard account when redeemed. If an order exceeds the amount of the GiftCard, the balance must be paid with a credit card or other available payment method.;50.0000;New;Yes
5;;;50's Rockabilly Polka Dot Top JR Plus Size;Apparel & Shoes>Shirts;http://www.local.albionextrusions.co.uk/p/5/50s-rockabilly-polka-dot-top-jr-plus-size;http://www.local.albionextrusions.co.uk/content/images/thumbs/0000023_50s-rockabilly-polka-dot-top-jr-plus-size_125.jpg;Fitted polkadot print cotton top with tie cap sleeves.;15.0000;New;Yes
6;;;Acer Aspire One 8.9" Mini-Notebook Case - (Black);Computers>Accessories;http://www.local.albionextrusions.co.uk/p/6/acer-aspire-one-89-mini-notebook-case-black;http://www.local.albionextrusions.co.uk/content/images/thumbs/0000024_acer-aspire-one-89-mini-notebook-case-black_125.jpeg;Acer Aspire One 8.9" Memory Foam Pouch is the perfect fit for Acer Aspire One 8.9". This pouch is made out of premium quality shock absorbing memory form and it provides extra protection even though case is very light and slim. This pouch is water resistant and has internal supporting bands for Acer Aspire One 8.9". Made In Korea.;21.6000;New;Yes
7;;;adidas Women's Supernova CSH 7 Running Shoe;Apparel & Shoes>Shoes;http://www.local.albionextrusions.co.uk/p/7/adidas-womens-supernova-csh-7-running-shoe;http://www.local.albionextrusions.co.uk/content/images/thumbs/0000026_adidas-womens-supernova-csh-7-running-shoe_125.jpg;Built to take you far and fast, Adidas Supernova Cushion 7 road-running shoes offer incredible cushioning and comfort with low weight. * Abrasion-resistant nylon mesh uppers are lightweight and highly breathable, synthetic leather overlays create structure and support * GeoFit construction at ankles provides an anatomically correct fit and extra comfort * Nylon linings and molded, antimicrobial dual-layer EVA footbeds dry quickly and fight odor * adiPRENE@ midsoles absorb shock in the heels and help maximize heel protection and stability * adiPRENE@+ under forefeet retains natural propulsive forces for improved efficiency * Torsion@ system at the midfoot allows natural rotation between the rearfoot and the forefoot, helping improve surface adaptability * ForMotion@ freely moving, decoupled heel system allows your feet to adapt to the ground strike and adjust for forward momentum * adiWEAR@ rubber outsoles give ample durability in high-wear areas and offer lightweight grip and cushion Mens shoes , men's shoes , running shoes , adidas shoes , adidas running shoes , mens running shoes , snova running shoes , snova mens adidas , snova adidas running , snova shoes , sport shoes mens , sport shoes adidas , mens shoes , men's shoes , running , adidas;40.0000;New;Yes
8;;;Adobe Photoshop Elements 7;Computers>Software;http://www.local.albionextrusions.co.uk/p/8/adobe-photoshop-elements-7;http://www.local.albionextrusions.co.uk/content/images/thumbs/0000028_adobe-photoshop-elements-7_125.jpeg;Adobe Photoshop Elements 7 software combines power and simplicity so you can make ordinary photos extraordinary, tell engaging stories in beautiful, personalized creations for print and web, and easily find and view all your photos. New Photoshop.com membership* works with Photoshop Elements so you can protect your photos with automatic online backup and 2 GB of storage, view your photos anywhere you are, and share your photos in fun, interactive ways with invitation-only Online Albums.;75.0000;New;Yes
9;;;APC Back-UPS RS 800VA - UPS - 800 VA - UPS battery - lead acid ( BR800BLK );Computers>Accessories;http://www.local.albionextrusions.co.uk/p/9/apc-back-ups-rs-800va-ups-800-va-ups-battery-lead-acid-br800blk-;http://www.local.albionextrusions.co.uk/content/images/thumbs/0000029_apc-back-ups-rs-800va-ups-800-va-ups-battery-lead-acid-br800blk-_125.jpeg;The Back-UPS RS offers high performance protection for your business and office computer systems. It provides abundant battery backup power, allowing you to work through medium and extended length power outages. It also safeguards your equipment from damaging surges and spikes that travel along utility, phone and network lines. A distinguishing feature of the Back-UPS RS is automatic voltage regulation (AVR). AVR instantly adjusts both low and high voltages to safe levels, so you can work indefinitely during brownouts and overvoltage situations, saving the battery for power outages when you need it most. Award-winning shutdown software automatically powers down your computer system in the event of an extended power outage.;75.0000;New;Yes
10;;;Arrow Men's Wrinkle Free Pinpoint Solid Long Sleeve;Apparel & Shoes>Shirts;http://www.local.albionextrusions.co.uk/p/10/arrow-mens-wrinkle-free-pinpoint-solid-long-sleeve;http://www.local.albionextrusions.co.uk/content/images/thumbs/0000030_arrow-mens-wrinkle-free-pinpoint-solid-long-sleeve_125.jpg;This Wrinkle Free Pinpoint Long Sleeve Dress Shirt needs minimum ironing. It is a great product at a great value!;24.0000;New;Yes
11;ASUS;;ASUS Eee PC 1000HA 10-Inch Netbook;Computers>Notebooks;http://www.local.albionextrusions.co.uk/p/11/asus-eee-pc-1000ha-10-inch-netbook;http://www.local.albionextrusions.co.uk/content/images/thumbs/0000031_asus-eee-pc-1000ha-10-inch-netbook_125.jpeg;Much more compact than a standard-sized notebook and weighing just over 3 pounds, the Eee PC 1000HA is perfect for students toting to school or road warriors packing away to Wi-Fi hotspots. The Eee PC 1000HA also features a 160 GB hard disk drive (HDD), 1 GB of RAM, 1.3-megapixel webcam integrated into the bezel above the LCD, 54g Wi-Fi networking (802.11b/g), Secure Digital memory card slot, multiple USB ports, a VGA output for connecting to a monitor.It comes preinstalled with the Microsoft Windows XP Home operating system, which offers more experienced users an enhanced and innovative experience that incorporates Windows Live features like Windows Live Messenger for instant messaging and Windows Live Mail for consolidated email accounts on your desktop. Complementing this is Microsoft Works, which equips the user with numerous office applications to work efficiently.The new Eee PC 1000HA has a customized, cutting-edge Infusion casing technology in Fine Ebony. Inlaid within the chassis itself, the motifs are an integral part of the entire cover and will not fade with time. The Infusion surface also provides a new level of resilience, providing scratch resistance and a beautiful style while out and about.;2600.0000;New;Yes
12;ASUS;;ASUS Eee PC 900HA 8.9-Inch Netbook Black;Computers>Notebooks;http://www.local.albionextrusions.co.uk/p/12/asus-eee-pc-900ha-89-inch-netbook-black;http://www.local.albionextrusions.co.uk/content/images/thumbs/0000032_asus-eee-pc-900ha-89-inch-netbook-black_125.jpeg;Much more compact than a standard-sized notebook and weighing just 2.5 pounds, the Eee PC 900HA is perfect for students toting to school or road warriors packing away to Wi-Fi hotspots. In addition to the 160 GB hard disk drive (HDD), the Eee PC 900HA also features 1 GB of RAM, VGA-resolution webcam integrated into the bezel above the LCD, 54g Wi-Fi networking (802.11b/g), multiple USB ports, SD memory card slot, a VGA output for connecting to a monitor, and up to 10 GB of online storage (complimentary for 18 months).It comes preinstalled with the Microsoft Windows XP Home operating system, which offers more experienced users an enhanced and innovative experience that incorporates Windows Live features like Windows Live Messenger for instant messaging and Windows Live Mail for consolidated email accounts on your desktop. Complementing this is Microsoft Works, which equips the user with numerous office applications to work efficiently.;1500.0000;New;Yes
13;;;Best Grilling Recipes;Books;http://www.local.albionextrusions.co.uk/p/13/best-grilling-recipes;http://www.local.albionextrusions.co.uk/content/images/thumbs/0000033_best-grilling-recipes_125.jpeg;Take a winding cross-country trip and you'll discover barbecue shacks with offerings like tender-smoky Baltimore pit beef and saucy St. Louis pork steaks. To bring you the best of these hidden gems, along with all the classics, the editors of Cook's Country magazine scoured the country, then tested and perfected their favorites. HEre traditions large and small are brought into the backyard, from Hawaii's rotisserie favorite, the golden-hued Huli Huli Chicken, to fall-off-the-bone Chicago Barbecued Ribs. In Kansas City, they're all about the sauce, and for our saucy Kansas City Sticky Ribs, we found a surprise ingredient-root beer. We also tackle all the best sides. Not sure where or how to start? This cookbook kicks off with an easy-to-follow primer that will get newcomers all fired up. Whether you want to entertain a crowd or just want to learn to make perfect burgers, Best Grilling Recipes shows you the way.;27.0000;New;Yes
14;;;Black & White Diamond Heart;Jewelry;http://www.local.albionextrusions.co.uk/p/14/black-white-diamond-heart;http://www.local.albionextrusions.co.uk/content/images/thumbs/0000034_black-white-diamond-heart_125.jpg;Bold black diamonds alternate with sparkling white diamonds along a crisp sterling silver heart to create a look that is simple and beautiful. This sleek and stunning 1/4 carat (ctw) diamond heart pendant which includes an 18 inch silver chain, and a free box of godiva chocolates makes the perfect Valentine's Day gift.;130.0000;New;Yes
15;;;BlackBerry Bold 9000 Phone, Black (AT&T);Electronics>Cell phones;http://www.local.albionextrusions.co.uk/p/15/blackberry-bold-9000-phone-black-att;http://www.local.albionextrusions.co.uk/content/images/thumbs/0000035_blackberry-bold-9000-phone-black-att_125.jpeg;Keep yourself on track for your next meeting with turn-by-turn directions via the AT@T Navigator service, which is powered by TeleNav and provides spoken or text-based turn-by-turn directions with automatic missed turn rerouting and a local business finder service in 20 countries. It also supports AT@T mobile music services and access to thousands of video clips via Cellular Video. Other features include a 2-megapixel camera/camcorder, Bluetooth for handsfree communication, 1 GB of internal memory with MicroSD expansion (up to 32 GB), multi-format audio/video playback, and up to 4.5 hours of talk time.The Blackberry Bold also comes with free access to AT@T Wi-Fi Hotspots, available at more than 17,000 locations nationwide including Starbucks. The best part is that you do'nt need to sign up for anything new to use this service--Wi-Fi access for is included in all Blackberry Personal and Enterprise Rate Plans. (You must subscribe to a Blackberry Data Rate Plan to access AT@T Wi-Fi Hotspots.) Additionally, the Blackberry Bold is the first RIM device that supports AT@T Cellular Video (CV).;245.0000;New;Yes
16;;;Build your own computer;Computers>Desktops;http://www.local.albionextrusions.co.uk/p/16/build-your-own-computer;http://www.local.albionextrusions.co.uk/content/images/thumbs/0000036_build-your-own-computer_125.jpeg;Fight back against cluttered workspaces with the stylish Sony VAIO JS All-in-One desktop PC, featuring powerful computing resources and a stunning 20.1-inch widescreen display with stunning XBRITE-HiColor LCD technology. The silver Sony VAIO VGC-JS110J/S has a built-in microphone and MOTION EYE camera with face-tracking technology that allows for easy communication with friends and family. And it has a built-in DVD burner and Sony's Movie Store software so you can create a digital entertainment library for personal viewing at your convenience. Easy to setup and even easier to use, this JS-series All-in-One includes an elegantly designed keyboard and a USB mouse.;1200.0000;New;Yes
17;;;Canon Digital Rebel XSi 12.2 MP Digital SLR Camera (Black);Electronics>Camera, photo;http://www.local.albionextrusions.co.uk/p/17/canon-digital-rebel-xsi-122-mp-digital-slr-camera;http://www.local.albionextrusions.co.uk/content/images/thumbs/0000041_canon-digital-rebel-xsi-122-mp-digital-slr-camera_125.jpeg;For stunning photography with point and shoot ease, look no further than Canon@s EOS Rebel XSi. The EOS Rebel XSi brings staggering technological innovation to the masses. It features Canon@s EOS Integrated Cleaning System, Live View Function, a powerful DIGIC III Image Processor, plus a new 12.2-megapixel CMOS sensor and is available in a kit with the new EF-S 18-55mm f/3.5-5.6 IS lens with Optical Image Stabilizer. The EOS Rebel XSi@s refined, ergonomic design includes a new 3.0-inch LCD monitor, compatibility with SD and SDHC memory cards and new accessories that enhance every aspect of the photographic experience.;670.0000;New;Yes
18;;;Canon Digital Rebel XSi 12.2 MP Digital SLR Camera (Silver);Electronics>Camera, photo;http://www.local.albionextrusions.co.uk/p/17/canon-digital-rebel-xsi-122-mp-digital-slr-camera;http://www.local.albionextrusions.co.uk/content/images/thumbs/0000041_canon-digital-rebel-xsi-122-mp-digital-slr-camera_125.jpeg;For stunning photography with point and shoot ease, look no further than Canon@s EOS Rebel XSi. The EOS Rebel XSi brings staggering technological innovation to the masses. It features Canon@s EOS Integrated Cleaning System, Live View Function, a powerful DIGIC III Image Processor, plus a new 12.2-megapixel CMOS sensor and is available in a kit with the new EF-S 18-55mm f/3.5-5.6 IS lens with Optical Image Stabilizer. The EOS Rebel XSi@s refined, ergonomic design includes a new 3.0-inch LCD monitor, compatibility with SD and SDHC memory cards and new accessories that enhance every aspect of the photographic experience.;630.0000;New;Yes
19;;;Canon VIXIA HF100 Camcorder;Electronics>Camera, photo;http://www.local.albionextrusions.co.uk/p/18/canon-vixia-hf100-camcorder;http://www.local.albionextrusions.co.uk/content/images/thumbs/0000043_canon-vixia-hf100-camcorder_125.jpeg;From Canon's long history of optical excellence, advanced image processing, superb performance and technological innovation in photographic and broadcast television cameras comes the latest in high definition camcorders. Now, with the light, compact Canon VIXIA HF100, you can have stunning AVCHD (Advanced Video Codec High Definition) format recording with the ease and numerous benefits of Flash Memory. It's used in some of the world's most innovative electronic products such as laptop computers, MP3 players, PDAs and cell phones. Add to that the VIXIA HF100's Canon Exclusive features such as our own 3.3 Megapixel Full HD CMOS sensor and advanced DIGIC DV II Image Processor, SuperRange Optical Image Stabilization, Instant Auto Focus, our 2.7-inch Widescreen Multi-Angle Vivid LCD and the Genuine Canon 12x HD video zoom lens and you have a Flash Memory camcorder that's hard to beat.;530.0000;New;Yes
20;;;Compaq Presario SR1519X Pentium 4 Desktop PC with CDRW;Computers>Desktops;http://www.local.albionextrusions.co.uk/p/19/compaq-presario-sr1519x-pentium-4-desktop-pc-with-cdrw;http://www.local.albionextrusions.co.uk/content/images/thumbs/0000044_compaq-presario-sr1519x-pentium-4-desktop-pc-with-cdrw_125.jpeg;Compaq Presario PCs give you solid performance, ease of use, and deliver just what you need so you can do more with less effort. Whether you are e-mailing family, balancing your online checkbook or creating school projects, the Presario is the right PC for you.;500.0000;New;Yes
21;;;Cooking for Two;Books;http://www.local.albionextrusions.co.uk/p/20/cooking-for-two;http://www.local.albionextrusions.co.uk/content/images/thumbs/0000045_cooking-for-two_125.jpeg;Hardcover: 352 pagesPublisher: America's Test Kitchen (May 2009)Language: EnglishISBN-10: 1933615435ISBN-13: 978-1933615431;19.0000;New;Yes
22;;;Corel Paint Shop Pro Photo X2;Computers>Software;http://www.local.albionextrusions.co.uk/p/21/corel-paint-shop-pro-photo-x2;http://www.local.albionextrusions.co.uk/content/images/thumbs/0000046_corel-paint-shop-pro-photo-x2_125.jpeg;Corel Paint Shop Pro Photo X2 is the ideal choice for any aspiring photographer's digital darkroom. Fix brightness, color, and photo flaws in a few clicks, use precision editing tools to create the picture you want, give photos a unique, exciting look using hundreds of special effects, and much more! Plus, the NEW one-of-a-kind Express Lab helps you quickly view and fix dozens of photos in the time it used to take to edit a few. Paint Shop Pro Photo X2 even includes a built-in Learning Center to help you get started, it's the easiest way to get professional-looking photos - fast!;65.0000;New;Yes
23;;;Custom T-Shirt;Apparel & Shoes>Shirts;http://www.local.albionextrusions.co.uk/p/22/custom-t-shirt;http://www.local.albionextrusions.co.uk/content/images/thumbs/0000047_custom-t-shirt_125.jpeg;Comfort comes in all shapes and forms, yet this tee out does it all. Rising above the rest, our classic cotton crew provides the simple practicality you need to make it through the day. Tag-free, relaxed fit wears well under dress shirts or stands alone in laid-back style. Reinforced collar and lightweight feel give way to long-lasting shape and breathability. One less thing to worry about, rely on this tee to provide comfort and ease with every wear.;15.0000;New;Yes
24;;;Diamond Pave Earrings;Jewelry;http://www.local.albionextrusions.co.uk/p/23/diamond-pave-earrings;http://www.local.albionextrusions.co.uk/content/images/thumbs/0000048_diamond-pave-earrings_125.jpg;Perfect for both a professional look as well as perhaps something more sensual, these 10 karat white gold huggie earrings boast 86 sparkling round diamonds set in a pave arrangement that total 1/2 carat (ctw).;569.0000;New;Yes
25;;;Diamond Tennis Bracelet;Jewelry;http://www.local.albionextrusions.co.uk/p/24/diamond-tennis-bracelet;http://www.local.albionextrusions.co.uk/content/images/thumbs/0000049_diamond-tennis-bracelet_125.jpg;Jazz up any outfit with this classic diamond tennis bracelet. This piece has one full carat of diamonds uniquely set in brilliant 10 karat white gold.;360.0000;New;Yes
26;;;EatingWell in Season;Books;http://www.local.albionextrusions.co.uk/p/25/eatingwell-in-season;http://www.local.albionextrusions.co.uk/content/images/thumbs/0000051_eatingwell-in-season_125.jpeg;Trying to get big chocolate flavor into a crisp holiday cookie is no easy feat. Any decent baker can get a soft, chewy cookie to scream @chocolate,@ but a dough that can withstand a rolling pin and cookie cutters simply can@t be too soft. Most chocolate butter cookies skimp on the gooey chocolate and their chocolate flavor is quite modest.;51.0000;New;Yes
27;;;etnies Men's Digit Sneaker;Apparel & Shoes>Shoes;http://www.local.albionextrusions.co.uk/p/26/etnies-mens-digit-sneaker;http://www.local.albionextrusions.co.uk/content/images/thumbs/0000052_etnies-mens-digit-sneaker_125.jpg;Established in 1986, etnies is the first skateboarder-owned and skateboarder-operated global action sports footwear and apparel company. etnies not only pushed the envelope by creating the first pro model skate shoe, but it pioneered technological advances and changed the face of skateboard footwear forever. Today, etnies' vision is to remain the leading action sports company committed to creating functional products that provide the most style, comfort, durability and protection possible. etnies stays true to its roots by sponsoring a world-class team of skateboarding, surfing, snowboarding, moto-x, and BMX athletes and continues its dedication by giving back to each of these communities.;17.5600;New;Yes
28;;;Genuine Leather Handbag with Cell Phone Holder & Many Pockets;Apparel & Shoes>Apparel accessories;http://www.local.albionextrusions.co.uk/p/27/genuine-leather-handbag-with-cell-phone-holder-many-pockets;http://www.local.albionextrusions.co.uk/content/images/thumbs/0000053_genuine-leather-handbag-with-cell-phone-holder-many-pockets_125.jpg;This fine leather handbag will quickly become your favorite bag. It has a zipper organizer on the front that includes a notepad pocket, pen holder, credit card slots and zipper pocket divider. On top of this is a zipper pocket and another flap closure pocket. The main compartment is fully lined and includes a side zipper pocket. On the back is another zipper pocket. And don't forget the convenient built in cell phone holder on the side! The long strap is fully adjustable so you can wear it crossbody or over the shoulder. This is a very well-made, quality leather bag that is not too big, but not too small.;35.0000;New;Yes
29;HP;;HP IQ506 TouchSmart Desktop PC;Computers>Desktops;http://www.local.albionextrusions.co.uk/p/28/hp-iq506-touchsmart-desktop-pc;http://www.local.albionextrusions.co.uk/content/images/thumbs/0000055_hp-iq506-touchsmart-desktop-pc_125.jpeg;Redesigned with a next-generation, touch-enabled 22-inch high-definition LCD screen, the HP TouchSmart IQ506 all-in-one desktop PC is designed to fit wherever life happens: in the kitchen, family room, or living room. With one touch you can check the weather, download your e-mail, or watch your favorite TV show. It's also designed to maximize energy, with a power-saving Intel Core 2 Duo processor and advanced power management technology, as well as material efficiency--right down to the packaging. It has a sleek piano black design with elegant espresso side-panel highlights, and the HP Ambient Light lets you set a mood--or see your keyboard in the dark.;1199.0000;New;Yes
30;HP;;HP Pavilion Artist Edition DV2890NR 14.1-inch Laptop;Computers>Notebooks;http://www.local.albionextrusions.co.uk/p/29/hp-pavilion-artist-edition-dv2890nr-141-inch-laptop;http://www.local.albionextrusions.co.uk/content/images/thumbs/0000056_hp-pavilion-artist-edition-dv2890nr-141-inch-laptop_125.jpeg;Optimize your mobility with a BrightView 14.1-inch display that has the same viewable area as a 15.4-inch screen--in a notebook that weighs a pound less. Encouraging more direct interaction, the backlit media control panel responds to the touch or sweep of a finger. Control settings for audio and video playback from up to 10 feet away with the included HP remote, then store it conveniently in the PC card slot. Enjoy movies or music in seconds with the external DVD or music buttons to launch HP QuickPlay (which bypasses the boot process).It's powered by the 1.83 GHz Intel Core 2 Duo T5550 processor, which provides an optimized, multithreaded architecture for improved gaming and multitasking performance, as well as excellent battery management. It also includes Intel's 4965 AGN wireless LAN, which will connect to draft 802.11n routers and offers compatibility with 802.11a/b/g networks as well. It also features a 250 GB hard drive, 3 GB of installed RAM (4 GB maximum), LighScribe dual-layer DVD&plusmn,R burner, HDMI port for connecting to an HDTV, and Nvidia GeForce Go 8400M GS video/graphics card with up to 1407 MB of total allocated video memory (128 MB dedicated). It also includes an integrated Webcam in the LCD's bezel and an omnidirectional microphone for easy video chats.;1590.0000;New;Yes
